HOLY JESUS OF NAZARETH BLESS THY CHILDERN. CHINA HAS TO PAY FOR THIS MESS. AMEN. 🇺🇸🇺🇸,-0.2103,4
Evil Democrat want to destroy job and economics,-0.8225,0
Clowns,0.0,0
No way pres gets re elected now,-0.296,0
How do I apply for unemployment if my hours have been cut in half,-0.6124,2
My boss threatened to fire me if i file for unemployment and i been out of work for 3 weeks,-0.8074,1
Weren’t Covid19 unemployment checks supposed to be 100% of your income per the CARE Act?,0.2577,0
We were told looking for work doesn't apply because we are being told to stay home since so many people are getting sick and dying. Why would be thinking of going out to work? Doesn't make sense,-0.5106,0
"Do I need to fill the unemployment claim every week or 2 to keep getting the benefit?

And if I didn't do my taxes this time can I still be eligible?

Really need answers",0.1179,0
"How do I get through for Texas??? 
I have had no success over the phone or on line. It’s been 3 weeks.",0.466,0
I live in California I filed on march 20th so I hope I get my next week,0.5777,0
Did they waived the waiting period in texas???,0.0,1
amazing video keep it up,0.5859,0
"There is no virus, it has a new world order, but it also has resistance.a lie capitalistic",-0.1531,0
So 6.6mm is the max the system can register per week?,0.0,1
There's the MSM reporting on BAD NEWS that happened LAST WEEK that everyone already knows..,-0.6408,0
California has 2.2 million.,0.0,1
"If an economy loose 6.5 trillion and get 3.5 trillion in the do call “stimulus,” it’s still deflation - soon even CNBC will loose major $ for ADS.",-0.5574,1
One of the downsides of moving to a service economy with no one to service,-0.296,2
Unemployment number is as many unemployed as can be processed.,-0.3818,2
On the bright side. Everyone don't have to worry about toilet paper anymore. Just use your $100 bills...,0.6492,0
I love my employer health insurance. Oh wait! Dummy America.,0.6696,0
CNBC should run the number to read correctly and not make it seem like it was 6.6 million once and not back to back.,0.4215,0
"I would around 8 million since the way they count it is very questionable.  I wouldn't trust these ""official numbers"".",-0.6661,4
Greatest economy ever trump lol the FED is making the whole world debt slaves,0.6705,1
Somebody's gonna have to pay for all this Brrrrrrrrrrrrrrr eventually. the fed just going crazy at this point the actual economics doesn't even matter anymore,-0.4356,5
i wonder how homeless people are doing these days.,0.0,4
Fantastic news the dow will go up to 30k soon.,0.5574,4
"Dow will climb 4% on this ""good"" news. Nothing to see here people, stay asleep, question nothing. Fed continues to go Brrrrrrrrr",0.0,8
"This number could never be pulled out of thin air. The impact of the locking down the nation should help cover up how bad the economy was before with completely bogus jobs numbers, consumer sentiment and black ops money flowing in at every key technical breakdown point.",-0.128,2
Shorters salivating,0.0,0
Futures just jumped to green after being red all day!!! Wtf.... Fed just announced more  Printing !!! I guess this is the norm now!!,0.0,4
The market is expensive on all measurements. The spivs will drive the market up supported by the reckless Federal reverse printing money. The reality and the market are out of step.,-0.1027,1
And it's ONLY at 6.6million because the systems keep crashing all over the USA.,0.0,10
签派湛祚。,0.0,0
well my friend that money still hasn't hit anyones account and you have systems down.,0.6486,2
2020 covid-19 deaths plus flu deaths better exceed 2019 flu deaths by a healthy margin or Bill Gates and his CIA handlers need to be charged with treason.,-0.5106,0
"Bring them over to the UK, we lost all our slave labour from Europe to pick fruit and veg in the fields, we need young fit people who are willing to sacrifice their back and spine in pursuit of a day wage",0.0516,2
Market is going to shoot up lmao,0.3612,5
"Market gonna jump on this amazing news..
Another 2% of Americans unemployed should be reason to celibate.",0.6705,26
"Is anybody else getting the message that their login information is incorrect? I keep getting the error message, whenever I try to file a claim, and I'm reading that it might not just be me.",-0.4019,1
when we will get that money?,0.0,0
1:15 what’s her name who is she,0.0,0
"3 WEEKS THOUSANDS OF CALLS GET NOWHERE, GET YOUR SHIT TOGETHER NY THIS IS RIDICULOUS BEEN HUNG UP ON 34 TIMES TODAY AFTER PUTTING SS AND PIN IN FIX THE PROBLEM PLEASE NO AVAILABLE REPS MY BUTT",-0.4766,0
I went out of work July of last year and my benefits expired January of this year because my job as a computer operator are not paying enough or far out of state. The crisis hit and now even trying for work is impossible due to the situation and I cannot get an more benefits until my work year expires. Any suggestions?,0.0258,0
I forgot my mom maiden name.....what should I do ?,0.0,1
"Cuomo will blame Trump for this too. Even though Trump wanted the extra unemployment funds distributed by the feds, not unprepared unemployment offices. All part of the planned dem panic",-0.8885,3
EVERYONE NEEDING UNEMPLOYMENT:  I went on the website between 2-4am when traffic is low & had no issues applying. Your welcome 🙃,-0.6037,1
"I have a serious question, my dad doesnt understand much, so I had to help him and I barely know anything either. So we filled it out, but one of the things we needed was a FEIN and the form never asked for it? Did we do something wrong? My uncle filled one out too and it ask him for it? Did I mess something up?",-0.819,0
It needs to be an all online process why the hell do you have to call after filing online. Been trying since March 18th no one picks up or you finally get through you enter your info then it tells you to hold and not even a second later it says all claim specialists are busy and it hangs up on you it doesnt even put you on hold to wait for someone it's so dumb.,-0.9009,4
"Why do we even have to call, i finally completed the online part after multiple attempts but it said now i have to call. They should just call us, or make it 100%! Its impossible to call.",0.0,9
I was almost done online until the site crashed and I couldn't log back in. I finally completed my claim application on the phone via automaton. My information is on file but apparently I have to speak to a claims representative (human) to begin recieving my benefits. No such luck! Hopefully I'll get retroactive benefits along with the enhanced benefits when it finally goes through as I lost work due to virus related state mandated shutdown.,0.923,2
"Here's the NY doctor who convinced President Trump to fast track that promising new drug treatment for Covid-19. Just approved by the FDA.
​https://youtu.be/m3J_1B7kJbk​",0.802,0
By not requireing those who did the application online to call in order to complete the claim would have been HUGE in relieving the issue. They failed. This all could have been handled much better.,0.6289,2
Guess what people the governor is not telling you there are too many people applying for this insurance and they do not have the money to pay you they are I just dragging their feet they do not have the funds but this many people to file all at one time the money is not there,-0.0516,5
You can file a claim all you want on a good day they refuse to pick up the phone for days you put your information on the internet and wait and wait and wait. And then you try to call them that's when the fun starts no one ever picks up the phone and that is in good times you can kiss your money goodbye there is no money no one is picking up the phone you could file online good luck with that and if your password gets locked out there's no one to call to get unlocked out don't count on that money you will not receive it we are waiting here in New York City way before the virus I did not even get an answer from these people they are lazy and they don't work,0.765,4
Nothing in the report about changing the phone system to a call back system?  Why not ask the obvious question.  This isn't technology rocket science all they need to do is create a list of numbers that call and call them back in order.  Maybe it takes days or weeks to get a call back but at least it will happen in order and people don't have to spend all day for weeks dialing a number they know won't work.  Do better with questions on why they are not changing the system.  Just adding more operators is not the solution.,-0.5502,11
"This is exactly what has/is occurring in Italy. If they don't get this fixed soon, N.Y. is going to have some serious looting/rioting/civil unrest to deal with.",-0.0772,5
It'll be Trump's fault by the end of the week.,-0.4019,6
"By the time I get through to unemployment ,the crisis will be over",-0.7906,22
This fucking governmentent wasn't read for the power of God may death give you years of life,-0.4215,0
Bullshit they can can't handle it,-0.5859,0
Keep updates hope we all get our benefits so we worked so hard now we have to pry everday,0.5623,3
"The people are suffering and senators and wealthy people have profited huge capital gains from stock sells in February. What a shame, a dam shame.",-0.2023,9
Everytime I try to file for unemployment they close me out and I have to start the process over again. They saying I need to download internet 5.0 which I think has alot to do with this new 5G they talking about.,-0.4404,5
Prying everyday  they fix it please,0.3182,4
"Thank you! Please keep reporting on this. We need exposure, we are being forgotten. I can not believe the amount of people who have been calling for not hours or days but WEEKS before getting a response. It is insane. Did the state not think about this befor shutting everything down. Its as is no one prepped for the inevitable tsunami of jobless nyers.",-0.69,18
FUCK NYC you voted in Liberal scum you lose your jobs...we don't care!,-0.8706,0
amazing video bro,0.5859,6
How could they buy food if they don't make money?,0.0,0
DAMN she need to eat More,-0.5319,0
no job is ever secure,0.0516,0
Time for people to do for self. Stop depending on the government. We need to start pulling together. Grow our own food and have a sense of community. Otherwise we are doomed.,-0.7506,0
Surprise the the checks are not here 4 weeks later no money......  ever people start...  Act... Crazy....,-0.0258,0
Riots are going to happen in lower income places.,-0.6705,0
nice content dude,0.4215,0
cool video keep it up,0.3182,0
This is what Bernie Sanders wanted to do for us. He realized his plan would fail thus dropping out of the presidential race,-0.5423,1
Back logging to the people....,0.0,0
7000000000 of ya,0.0,0
I work at the Chattanooga Convention Center. It has been closed and will soon be used as a hospital. I file for unemployment but for some reason my claim was denied. I have not had a paycheck since March 3rd. I am feeling so much anger right now that I want to make someone hurt. My money is running out and I think I would rather be in jail than be homeless. I wonder how many people are in the same situation and if they feel the same anger I do. What happens when we are all desperate and angry. The government is just kicking the working man in the balls again.,-0.9827,0
Wait what?  Why are they dumping tons of milk?  They can distribute them to people for free or sell for cheap.  I don't understand.,0.3313,0
"And even in this pandemic,  field and crop workers are busting their back and doing their job. They are essential workers and they need  to be treated with respect!!!!",0.0,1
Make America Great Depression Again!,0.1759,0
"It's past time for the CELEBRITY ELITE to give back:  Over-paid billionaire SPORTS FIGURES AND OWNERSHIP. 
HOLLYWOOD ACTORS, DIRECTORS, and CORPORATIONS. MUSIC CELEBRITIES. 
All these people have been realizing obscene amounts of money from those who supported their careers for decades. 
Time for ALL OF THESE PEOPLE to give back...now! Don't be sitting back watching your fellow (relatively few) celebrities toss a million here, a million there and think we are not aware of those whom are not contributing.",-0.4199,5
trump should nuke china,0.0,0
You mean next month may ..peoples can't wait for their check until September smh,-0.3182,3
Thanks to chinese,0.4404,5
It's much worse than that. The BBC reported up to 10 million Americans have filed for unemployment so far.,-0.7184,1
nice content keep it up bro,0.4215,1
cool video keep up the good content,0.6369,1
This is all very interesting I suppose but the real problem is... how will we blame all of this on Obama?,-0.6862,1
"If we had a real president, it wouldn't have been this bad. Dump Trump in November.",-0.7734,3
First,0.0,2
I'm waiting to invest in index fund Warner buffet 😷,0.0,0
Market soaring on this great news!,0.7325,0
I have Invested like Hell in US and European Airlines,-0.4767,0
"Print more money everyday and then put it in the stock market.  Biggest Ponzi scheme ever!!  I’m hoping for a Great Depression. This way the 
Feds will print more money and then give us a stimulus check that will be HUGE!  We won’t ever have to work!   How great is that ???? The crash
 will come when stimulus money runs out.. one cannot keep largest economy in stimulus for ever.  With no wide spread testing and vaccine 
available.. we will see another huge sell off soon.  Just hang on ! What are they manufacturing to cause the DOW TO RALLY ?  ANSWER: DEBT.  The 
US taxpayers just paid off the gambling debts of INVESTMENT BANKERS. The DOW is celebrating the alchemy scheme of turning worthless paper 
assets into legal tender, by an ACT of Congress.",0.8917,0
"Market keeps going up,seem like nobody care unemployment",0.4215,0
"Markets don't care about un-employment.   Fresh All time Highs, right around the Corner.   S&P has Not broke 2009 Trend line, meaning Still a BULL",0.2509,0
"Fake Money is not solutions anything !!!

😎😎😎😎😎😎😎😎😎😎😎😎😎",-0.6698,0
"Time to revolutions central bank every nation !!!!

🔥🔥🔥🔥🔥🔥🔥🔥🔥🔥🔥🔥🔥🔥🔥",0.0,0
Sounds like good news the market will rally,0.6597,2
Texas unemployment site is down. Doubt they will even get accurate numbers going forward.,-0.6597,3
Wtf is going on? This is it???? How long this shit is going to last??? OMG 😱 SOME PEOLE SAYS 2 weeks others one month and many said a year !!!!! Wtf????,-0.9038,0
So when this is over he won’t have a job there anymore?,0.0,0
How is this helpful ?,0.5023,2
"feel bad 4 this dude,but i could have watched this on the news.video not helful ...not at all.",-0.5423,0
I was collecting my EDD payments that started 10/12/19 and just collected my last check on 3/29/20; I’m looking for work with no luck due to the Virus; can I qualify for an Extension under CARES ACT?,0.6739,0
"I don't think she knows what the new bill includes, that's why she didn't really answer any questions.  She just gave vague answers and keeps saying stay tuned.   I've been trying to reach EDD via phone and I have not been able to get through the past month.  The recording said their hours are only 8am-noon.  Their website doesn't give me the answers and I am having anxiety.  I'm sure a lot of us feel the same.",0.0772,0
"So a slightly different scenario, I have over $4000 left in my unemployment because I found work and didn't need it for a couple months. Now i'm out of work and have reopened my claim and receiving payments like normal. **** But my claim period (52 weeks, Go California!) ends in 2 weeks.*** Since my benefits have not been depleted, but my claim will expire on 4/18/20, will I need to reapply to continue receiving benefits or due to the pandemic it will keep going until the government says so.
{By the way, this is strictly about regular UI Benefits NOT the stimulus package $600 a week}",0.8268,1
Looking ominous. I recieved a letter yesterday Apri 3rd......tells me I havnt complied blah blah.....I'm supposed to recieve another 5 weeks in Ga. thst I've  EARNED. I was supposed to get 13 weeks extension and 600 extra per week for about 4 months. If it sounds too good to be true........ looking like Govt. Employees still get $ printed up for them but everyone else......not so much.,0.2023,0
I have no internet and the edd office usually does it for me and I don't know how to do it.,-0.296,0
All those answers to the questions are on the EDD website. What I want to know is when will those that qualify see the additional $600.00 a week.  I'm grateful for something but the weekly benefits I was approved for is ridiculous. It makes sense if they plan to add the additional stimulus amount but not as a stand alone payment. Does anyone out there have any idea of when we might see the additional income?,0.797,7
So she's not talking anything about the stimulus package by the government. She's just talking about regular unemployment. How could you not include anything about this new bill that was just signed? Why do this if you're not going to have the right or complete information?,-0.504,4
Her answers are now out of date. Contract workers now do qualify for UI benefits according to what was signed into law,0.3818,3
My claim was before Corona virus. Do I Qualify.,0.0,1
Would people get extension those whom were already in receiving unemployment?,-0.4404,8
Doesn’t the new bill allow for contractors and self employed to be eligible now?,0.2263,2
can i claim as a self employed Real Estate Appraiser?,0.0,1
"There's something wrong about the fact that even HERE, she wasn't able to definitively answer the question. It's a STRAIGHT FORWARD QUESTION. If your benefits have lapsed before this package became a law, are you eligible for the 13 week extension? It shouldn't be a question of vaguery like this. We're stuck at home because of a pandemic that has rightfully ground life as we know it to a halt.",0.3885,19
My unemployment benefits ended a week before the Coronavirus hit. Will I be able to get a 13 week extension? I have an autoimmune disease and was told to stay home by my doctor and have been in lockdown unable to get a new job or go out and work,-0.0772,5
"Im currently receivr unemployment prior to coronavirus and have 3 payment left, will my benefits continue automatically or do i nees to reapply once my ais runs out.   I just found some answers

Q.  I’m already receiving unemployment benefits. Would I receive any help?
A: Yes. Even if you’re already receiving unemployment benefits for reasons unrelated to the coronavirus, your state-level benefits would still be extended by 13 weeks. You would also receive the extra $600 weekly benefit from the federal government.

Q: My unemployment recently ran out — could I sign up again?
A: Yes. If you’ve exhausted your benefits, eligible workers could g ..

Read more at:
https://economictimes.indiatimes.com/news/international/business/faq-on-stimulus-checks-unemployment-and-the-coronavirus-bill/articleshow/74859109.cms?utm_source=contentofinterest&utm_medium=text&utm_campaign=cppst",0.8604,8
"Hi,
Thanks for this report.  Years ago, I had to file for unemployment in CA, and it took 4 months to receive my first check which was devastating.  I wish you would have found out how long people are having to wait for a check once they file. Thanks 😊",0.0772,2
The world will ran out of $ for everyone. In time governments around the world will bring in tight measures etc . We won’t be able to function as we have . We are on our knees and will go below that . Potentially there will be civil disobedience on a large scale. China will be fully aware of all the worlds situation and will cease on this . We produced beautiful music and art and enjoyed being creative. But we didn’t have our eye on the ball for something like this . We will all pay Heavily for this,0.9042,2
IF YOU WEREN'T A BOTTOM DISCRIMINATIOR YOU WOULDN'T BE CRYING SO MUCH AND YOU WOULD KNOW THE ANSWER TO YOUR OWN QUESTION!!! LMAOLMAOLMAOLMAOLMAOLMAOLMAO! - GYRO MEMORIA,0.575,0
CNBC is a nazi station. They cant do math or allow comments that prove the facts! Communist propagandists!,0.3578,0
LMAO !,0.636,0
"Being that im laid off my part time job,Will i still get unemployment if im working a full time job?",-0.4404,0
THANKS GOD FOR EVERYTHING,0.6124,0
"The Fed and loans? When everyone has bad credit, due to loss of income, who can qualify for these ‘loans’?",-0.5514,0
Bills dont care,-0.3875,0
"File for uneployment, I would love to also do so. Now it looks like there would be only 50% of busy times in restaurants with now less tabies and chairs.- Allen Shinn",0.7717,0
"So long as trump remains in office this will get worse and worse, this administration and fake president is the worst in history of America  and the results is evident by this mishandling of this crisis!!",-0.9631,0
I'm 13 what happens when u unemploy they pay u right? And how much?,-0.1926,0
"Like the iPhone, it only gets worst.",-0.3818,0
DOOMSDAY SCENARIOS NOW FOLKS,-0.5859,1
Americans have to go Canada for better options maybe in future,0.4404,0
Do I need to fill the unemployment claim every week or 2 to keep getting the benefit?,0.0258,0
It is more than that. There some more coming from restaurant that's about to be unemployed.,0.0,0
It is more than that. There some more coming from restaurant that's about to be unemployed.,0.0,0
"What about the MILLIONS of us who are in transition between jobs LOOKING for new work? Why don't we qualify for unemployment? Through no fault of our own, job closures and quarantines have reduced job opportunities by half.",-0.6767,0
"What if the fact finder lied about trying to call you at the scheduled time of a FF interview?

Like, they said your cell phone had a busy tone. Granted, in extreme cases will this happen.

But 99.9% of all incoming calls DO NOT have a busy signal.",0.6633,0
the Trumps great depression why does it not surprise me that Trump Bankrupted the United States like all the companies he's ever had...,0.5975,0
Learn how to make money online. Check this out! Paid ad: denisdoan.com/money,0.0,0
These amazon commercial was awful,-0.3182,0
Millions are gonna lose there jobs so how are people gonna survival these situation if these goes on for Year's and on and on.,-0.4019,0
How many of those Americans are getting the 1200/500? Probably not half.,0.0,3
"There are gonna be more filing. I will be, I just have to add up all the money I made last year.",0.0,1
Amazon just had an outbreak in covid stay away,0.1779,1
Looks like Trump is gonna reopen the country on Easter after all :),0.6705,0
Wow,0.5859,0
Who would have thought grocery jobs would be the most sustainable in 2020.. 😳,0.0,0
Trump speak https://youtu.be/fv2_mdqxL0k,0.0,0
"Hail Das Kapital! Hail The Communist Manifesto! Hail freedom fighter Winnie Mandela! Praises to the proletariat! Hail Che! Detach, dismember and discard all uterine parasites! Send all blasphemers to concentration, ahem, vocational training centers. Love Is Love! ---- A Progressive thinker",0.9636,0
It's ok. The banks will bail out the people... not.,0.296,2
Apply at Amazon. They are hiring and are paying $2 more an hour and double pay for overtime. Also no drug test because of covid-19.,-0.2263,0
Lol. The U.S. is a joke. They should have been far more prepared but I suppose having an infant for president can lead to mismanagement.,0.476,0
What's wrong with this if you're working and you're getting a small pension or Social Security you're not allowed to collect unemployment you're working because you need the money on top of what social security or a small pension gave you that's wrong that your company pays into unemployment for you and you can't access it because you have another form of income,-0.7506,0
"Tough times...i hope things get better soon, i hope help reach those who need them. Stay safe",0.9169,0
"JESUS IS COMING TO RAPTURE CHRISTIANS!!!   PLEASE ACCEPT HIM AS YOUR SAVIOR NOW, DON'T WAIT ANOTHER MINUTE!!!  YOU DON'T WANT TO BE LEFT BEHIND IN THE WICKEDNESS THAT WILL BE UNLEASHED!!   TURN FROM YOUR SIN AND DEVOTE  YOURSELF TO HIM WITH YOUR WHOLE HEART!!!   ❤",-0.2937,0
"lost my job, lost my apartment, bought a car big enough to sleep in just in case. super amazing...",0.0772,5
Hurry gopees get you minimum wage jobs at Walmart.,0.0,0
"Trumps economy,  tired of winning yet?
Trump will blame Hillary or Obama.",-0.2263,0
"I think it would have been better to do it like us here in Sweden, stay at home those who feel symptoms and those who dont go to work, because this losing jobs thing will make ppl more depressed and suicidal I think.",-0.788,1
"amazing recovery
https://www.youtube.com/watch?v=FYgc_dIuhYo",0.5859,0
Anybody else still receiving paychecks ?,0.0,0
To women out there I’m hiring,0.0,0
These people with capabilities need to figure it out getting scared and banking on unemployment is silly ...humans are better than this,-0.4215,0
"Alot filing have time to take out,wait till it runs out...So you'll realise",0.0,1
"Get yeh seeds plant them and reap 
We all should have been planting fruit bearing trees, vines, plants but we were to busy with fruitless weeping willows and bushes, killing dandelions not making our teas cuz they were weeds.  I look to the left an ornamental pear tree I look to the right still no fruitful tree in sight!!  Squirrel can I get a nut?",-0.94,0
